A1: 1 | B1: NETB131 | C1: Programming language | D1: * A+
A2: =A1+1 -> 2 | B2: NETB131 | C2: Programming language | D2: * A++
A3: =A2+1 -> 3 | B3: NETB131 | C3: Programming language | D3: * ABAP
A4: =A3+1 -> 4 | B4: NETB131 | C4: Programming language | D4: * ActionScript
A5: =A4+1 -> 5 | B5: NETB131 | C5: Programming language | D5: * Ace DASL
A6: =A5+1 -> 6 | B6: NETB131 | C6: Programming language | D6: * Afnix
A7: =A6+1 -> 7 | B7: NETB131 | C7: Programming language | D7: * Agora
A8: =A7+1 -> 8 | B8: NETB131 | C8: Programming language | D8: * Aikido
A9: =A8+1 -> 9 | B9: NETB131 | C9: Programming language | D9: * ALF
A10: =A9+1 -> 10 | B10: NETB131 | C10: Programming language | D10: * Alice
A11: =A10+1 -> 11 | B11: NETB131 | C11: Programming language | D11: * APL
A12: =A11+1 -> 12 | B12: NETB131 | C12: Programming language | D12: * AppleScript
A13: =A12+1 -> 13 | B13: NETB131 | C13: Programming language | D13: * AWK
A14: =A13+1 -> 14 | B14: NETB131 | C14: Programming language | D14: * B
A15: =A14+1 -> 15 | B15: NETB131 | C15: Programming language | D15: * bc
A16: =A15+1 -> 16 | B16: NETB131 | C16: Programming language | D16: * BLISS
A17: =A16+1 -> 17 | B17: NETB131 | C17: Programming language | D17: * Boo
A18: =A17+1 -> 18 | B18: NETB131 | C18: Programming language | D18: * Brainfuck
A19: =A18+1 -> 19 | B19: NETB131 | C19: Programming language | D19: * C--
A20: =A19+1 -> 20 | B20: NETB131 | C20: Programming language | D20: * Caml
A21: =A20+1 -> 21 | B21: NETB131 | C21: Programming language | D21: * Cat
A22: =A21+1 -> 22 | B22: NETB131 | C22: Programming language | D22: * Cayenne
A23: =A22+1 -> 23 | B23: NETB131 | C23: Programming language | D23: * Cecil
A24: =A23+1 -> 24 | B24: NETB131 | C24: Programming language | D24: * Cesil
A25: =A24+1 -> 25 | B25: NETB131 | C25: Programming language | D25: * CFML
A26: =A25+1 -> 26 | B26: NETB131 | C26: Programming language | D26: * Chapel
A27: =A26+1 -> 27 | B27: NETB131 | C27: Programming language | D27: * Cilk
A28: =A27+1 -> 28 | B28: NETB131 | C28: Programming language | D28: * Claire
A29: =A28+1 -> 29 | B29: NETB131 | C29: Programming language | D29: * Clarion
A30: =A29+1 -> 30 | B30: NETB131 | C30: Programming language | D30: * Clean
A31: =A30+1 -> 31 | B31: NETB131 | C31: Programming language | D31: * Clipper
A32: =A31+1 -> 32 | B32: NETB131 | C32: Programming language | D32: * Cobra
A33: =A32+1 -> 33 | B33: NETB131 | C33: Programming language | D33: * Cool
A34: =A33+1 -> 34 | B34: NETB131 | C34: Programming language | D34: * CorVision
A35: =A34+1 -> 35 | B35: NETB131 | C35: Programming language | D35: * Csound
A36: =A35+1 -> 36 | B36: NETB131 | C36: Programming language | D36: * Cyclone
A37: =A36+1 -> 37 | B37: NETB131 | C37: Programming language | D37: * Dao
A38: =A37+1 -> 38 | B38: NETB131 | C38: Programming language | D38: * DataFlex
A39: =A38+1 -> 39 | B39: NETB131 | C39: Programming language | D39: * Dylan
A40: =A39+1 -> 40 | B40: NETB131 | C40: Programming language | D40: * Easy PL/I
A41: =A40+1 -> 41 | B41: NETB131 | C41: Programming language | D41: * ECMAScript
A42: =A41+1 -> 42 | B42: NETB131 | C42: Programming language | D42: * Eiffel
A43: =A42+1 -> 43 | B43: NETB131 | C43: Programming language | D43: * Epigram
A44: =A43+1 -> 44 | B44: NETB131 | C44: Programming language | D44: * Erlang
A45: =A44+1 -> 45 | B45: NETB131 | C45: Programming language | D45: * Escapade
A46: =A45+1 -> 46 | B46: NETB131 | C46: Programming language | D46: * Esterel
A47: =A46+1 -> 47 | B47: NETB131 | C47: Programming language | D47: * Euphoria
A48: =A47+1 -> 48 | B48: NETB131 | C48: Programming language | D48: * Factor
A49: =A48+1 -> 49 | B49: NETB131 | C49: Programming language | D49: * Falcon
A50: =A49+1 -> 50 | B50: NETB131 | C50: Programming language | D50: * Felix
A51: =A50+1 -> 51 | B51: NETB131 | C51: Programming language | D51: * Ferite
A52: =A51+1 -> 52 | B52: NETB131 | C52: Programming language | D52: * Forth
A53: =A52+1 -> 53 | B53: NETB131 | C53: Programming language | D53: * F-Script
A54: =A53+1 -> 54 | B54: NETB131 | C54: Programming language | D54: * HaXe
A55: =A54+1 -> 55 | B55: NETB131 | C55: Programming language | D55: * Hugo
A56: =A55+1 -> 56 | B56: NETB131 | C56: Programming language | D56: * Icon
A57: =A56+1 -> 57 | B57: NETB131 | C57: Programming language | D57: * Inform
A58: =A57+1 -> 58 | B58: NETB131 | C58: Programming language | D58: * Io
A59: =A58+1 -> 59 | B59: NETB131 | C59: Programming language | D59: * Ioke
A60: =A59+1 -> 60 | B60: NETB131 | C60: Programming language | D60: * J
A61: =A60+1 -> 61 | B61: NETB131 | C61: Programming language | D61: * JADE
A62: =A61+1 -> 62 | B62: NETB131 | C62: Programming language | D62: * JASS
A63: =A62+1 -> 63 | B63: NETB131 | C63: Programming language | D63: * Joule
A64: =A63+1 -> 64 | B64: NETB131 | C64: Programming language | D64: * Joy
A65: =A64+1 -> 65 | B65: NETB131 | C65: Programming language | D65: * JSP
A66: =A65+1 -> 66 | B66: NETB131 | C66: Programming language | D66: * Kite
A67: =A66+1 -> 67 | B67: NETB131 | C67: Programming language | D67: * Lasso
A68: =A67+1 -> 68 | B68: NETB131 | C68: Programming language | D68: * Linoleum
A69: =A68+1 -> 69 | B69: NETB131 | C69: Programming language | D69: * Lisaac
A70: =A69+1 -> 70 | B70: NETB131 | C70: Programming language | D70: * LPC
A71: =A70+1 -> 71 | B71: NETB131 | C71: Programming language | D71: * Lucid
A72: =A71+1 -> 72 | B72: NETB131 | C72: Programming language | D72: * Maya (MEL)
A73: =A72+1 -> 73 | B73: NETB131 | C73: Programming language | D73: * Mercury
A74: =A73+1 -> 74 | B74: NETB131 | C74: Programming language | D74: * MetaL
A75: =A74+1 -> 75 | B75: NETB131 | C75: Programming language | D75: * Miranda
A76: =A75+1 -> 76 | B76: NETB131 | C76: Programming language | D76: * ML
A77: =A76+1 -> 77 | B77: NETB131 | C77: Programming language | D77: * Mondrian
A78: =A77+1 -> 78 | B78: NETB131 | C78: Programming language | D78: * MOO
A79: =A78+1 -> 79 | B79: NETB131 | C79: Programming language | D79: * MPD
A80: =A79+1 -> 80 | B80: NETB131 | C80: Programming language | D80: * NATURAL
A81: =A80+1 -> 81 | B81: NETB131 | C81: Programming language | D81: * Neko
A82: =A81+1 -> 82 | B82: NETB131 | C82: Programming language | D82: * Nial
A83: =A82+1 -> 83 | B83: NETB131 | C83: Programming language | D83: * Nosica
A84: =A83+1 -> 84 | B84: NETB131 | C84: Programming language | D84: * Oak
A85: =A84+1 -> 85 | B85: NETB131 | C85: Programming language | D85: * Oberon
A86: =A85+1 -> 86 | B86: NETB131 | C86: Programming language | D86: * Object Lisp
A87: =A86+1 -> 87 | B87: NETB131 | C87: Programming language | D87: * Object Pascal
A88: =A87+1 -> 88 | B88: NETB131 | C88: Programming language | D88: * Objective-C
A89: =A88+1 -> 89 | B89: NETB131 | C89: Programming language | D89: * Objective Caml
A90: =A89+1 -> 90 | B90: NETB131 | C90: Programming language | D90: * Objective-J
A91: =A90+1 -> 91 | B91: NETB131 | C91: Programming language | D91: * occam
A92: =A91+1 -> 92 | B92: NETB131 | C92: Programming language | D92: * OmniMark
A93: =A92+1 -> 93 | B93: NETB131 | C93: Programming language | D93: * OPL
A94: =A93+1 -> 94 | B94: NETB131 | C94: Programming language | D94: * Oxygene
A95: =A94+1 -> 95 | B95: NETB131 | C95: Programming language | D95: * Oz
A96: =A95+1 -> 96 | B96: NETB131 | C96: Programming language | D96: * PCASTL
A97: =A96+1 -> 97 | B97: NETB131 | C97: Programming language | D97: * Phrogram
A98: =A97+1 -> 98 | B98: NETB131 | C98: Programming language | D98: * Pico
A99: =A98+1 -> 99 | B99: NETB131 | C99: Programming language | D99: * Pike
A100: =A99+1 -> 100 | B100: NETB131 | C100: Programming language | D100: * PIKT
A101: =A100+1 -> 101 | B101: NETB131 | C101: Programming language | D101: * Processing
A102: =A101+1 -> 102 | B102: NETB131 | C102: Programming language | D102: * Prograph
A103: =A102+1 -> 103 | B103: NETB131 | C103: Programming language | D103: * Q
A104: =A103+1 -> 104 | B104: NETB131 | C104: Programming language | D104: * Qi
A105: =A104+1 -> 105 | B105: NETB131 | C105: Programming language | D105: * QPL
A106: =A105+1 -> 106 | B106: NETB131 | C106: Programming language | D106: * R
A107: =A106+1 -> 107 | B107: NETB131 | C107: Programming language | D107: * REFAL
A108: =A107+1 -> 108 | B108: NETB131 | C108: Programming language | D108: * REXX
A109: =A108+1 -> 109 | B109: NETB131 | C109: Programming language | D109: * Sather
A110: =A109+1 -> 110 | B110: NETB131 | C110: Programming language | D110: * Scala
A111: =A110+1 -> 111 | B111: NETB131 | C111: Programming language | D111: * Scheme
A112: =A111+1 -> 112 | B112: NETB131 | C112: Programming language | D112: * Sed
A113: =A112+1 -> 113 | B113: NETB131 | C113: Programming language | D113: * Self
A114: =A113+1 -> 114 | B114: NETB131 | C114: Programming language | D114: * Span
A115: =A114+1 -> 115 | B115: NETB131 | C115: Programming language | D115: * SPARK
A116: =A115+1 -> 116 | B116: NETB131 | C116: Programming language | D116: * Squirrel
A117: =A116+1 -> 117 | B117: NETB131 | C117: Programming language | D117: * SuperCollider
A118: =A117+1 -> 118 | B118: NETB131 | C118: Programming language | D118: * Yoix