A1: 1 | B1: * A+
A2: =A1+1 -> 2 | B2: * A++
A3: =A2+1 -> 3 | B3: * ABAP
A4: =A3+1 -> 4 | B4: * ABC
A5: =A4+1 -> 5 | B5: * ABC ALGOL
A6: =A5+1 -> 6 | B6: * Abel
A7: =A6+1 -> 7 | B7: * ABLE
A8: =A7+1 -> 8 | B8: * ABSET
A9: =A8+1 -> 9 | B9: * ABSYS
A10: =A9+1 -> 10 | B10: * Abundance
A11: =A10+1 -> 11 | B11: * ACC
A12: =A11+1 -> 12 | B12: * Accent
A13: =A12+1 -> 13 | B13: * ActForex
A14: =A13+1 -> 14 | B14: * ActionScript
A15: =A14+1 -> 15 | B15: * Ace DASL
A16: =A15+1 -> 16 | B16: * ACT-III
A17: =A16+1 -> 17 | B17: * Adenine
A18: =A17+1 -> 18 | B18: * Afnix
A19: =A18+1 -> 19 | B19: * Agora
A20: =A19+1 -> 20 | B20: * AIS Balise
A21: =A20+1 -> 21 | B21: * Aikido
A22: =A21+1 -> 22 | B22: * ALF
A23: =A22+1 -> 23 | B23: * Alice
A24: =A23+1 -> 24 | B24: * Ambi
A25: =A24+1 -> 25 | B25: * Amiga E
A26: =A25+1 -> 26 | B26: * AMOS
A27: =A26+1 -> 27 | B27: * AMPLE
A28: =A27+1 -> 28 | B28: * AngelScript
A29: =A28+1 -> 29 | B29: * APL
A30: =A29+1 -> 30 | B30: * AppleScript
A31: =A30+1 -> 31 | B31: * Arc
A32: =A31+1 -> 32 | B32: * Arduino
A33: =A32+1 -> 33 | B33: * ATS
A34: =A33+1 -> 34 | B34: * AutoHotkey
A35: =A34+1 -> 35 | B35: * AutoIt
A36: =A35+1 -> 36 | B36: * Averest
A37: =A36+1 -> 37 | B37: * AWK
A38: =A37+1 -> 38 | B38: * B
A39: =A38+1 -> 39 | B39: * Bash
A40: =A39+1 -> 40 | B40: * bc
A41: =A40+1 -> 41 | B41: * BCPL
A42: =A41+1 -> 42 | B42: * BeanShell
A43: =A42+1 -> 43 | B43: * Bertrand
A44: =A43+1 -> 44 | B44: * BETA
A45: =A44+1 -> 45 | B45: * Bigwig
A46: =A45+1 -> 46 | B46: * Bistro
A47: =A46+1 -> 47 | B47: * BitC
A48: =A47+1 -> 48 | B48: * BLISS
A49: =A48+1 -> 49 | B49: * Blue
A50: =A49+1 -> 50 | B50: * Bon
A51: =A50+1 -> 51 | B51: * Boo
A52: =A51+1 -> 52 | B52: * Boomerang
A53: =A52+1 -> 53 | B53: * BPEL
A54: =A53+1 -> 54 | B54: * Brainfuck
A55: =A54+1 -> 55 | B55: * BUGSYS
A56: =A55+1 -> 56 | B56: * BuildProfessional
A57: =A56+1 -> 57 | B57: * C--
A58: =A57+1 -> 58 | B58: * C/AL
A59: =A58+1 -> 59 | B59: * Cache ObjectScript
A60: =A59+1 -> 60 | B60: * Caml
A61: =A60+1 -> 61 | B61: * Cat
A62: =A61+1 -> 62 | B62: * Cayenne
A63: =A62+1 -> 63 | B63: * Cecil
A64: =A63+1 -> 64 | B64: * Cel
A65: =A64+1 -> 65 | B65: * Cesil
A66: =A65+1 -> 66 | B66: * CFML
A67: =A66+1 -> 67 | B67: * Chapel
A68: =A67+1 -> 68 | B68: * CHAIN
A69: =A68+1 -> 69 | B69: * Charity
A70: =A69+1 -> 70 | B70: * Chef
A71: =A70+1 -> 71 | B71: * CHILL
A72: =A71+1 -> 72 | B72: * CHIP-8
A73: =A72+1 -> 73 | B73: * chomski
A74: =A73+1 -> 74 | B74: * CHR
A75: =A74+1 -> 75 | B75: * Chrome
A76: =A75+1 -> 76 | B76: * ChucK
A77: =A76+1 -> 77 | B77: * CICS
A78: =A77+1 -> 78 | B78: * CIL
A79: =A78+1 -> 79 | B79: * Cilk
A80: =A79+1 -> 80 | B80: * CL (Honeywell)
A81: =A80+1 -> 81 | B81: * Claire
A82: =A81+1 -> 82 | B82: * Clarion
A83: =A82+1 -> 83 | B83: * Clean
A84: =A83+1 -> 84 | B84: * Clipper
A85: =A84+1 -> 85 | B85: * Clojure
A86: =A85+1 -> 86 | B86: * CLU
A87: =A86+1 -> 87 | B87: * CMS-2
A88: =A87+1 -> 88 | B88: * Cobra
A89: =A88+1 -> 89 | B89: * CODE
A90: =A89+1 -> 90 | B90: * Cola
A91: =A90+1 -> 91 | B91: * ColdC
A92: =A91+1 -> 92 | B92: * ColdFusion
A93: =A92+1 -> 93 | B93: * COMPASS
A94: =A93+1 -> 94 | B94: * Component Pascal
A95: =A94+1 -> 95 | B95: * COMIT
A96: =A95+1 -> 96 | B96: * Converge
A97: =A96+1 -> 97 | B97: * Cool
A98: =A97+1 -> 98 | B98: * Coral 66
A99: =A98+1 -> 99 | B99: * Corn
A100: =A99+1 -> 100 | B100: * CorVision
A101: =A100+1 -> 101 | B101: * COWSEL
A102: =A101+1 -> 102 | B102: * CPL
A103: =A102+1 -> 103 | B103: * csh
A104: =A103+1 -> 104 | B104: * CSP
A105: =A104+1 -> 105 | B105: * Csound
A106: =A105+1 -> 106 | B106: * Curry
A107: =A106+1 -> 107 | B107: * Cyclone
A108: =A107+1 -> 108 | B108: * Dao
A109: =A108+1 -> 109 | B109: * DarkBASIC
A110: =A109+1 -> 110 | B110: * DarkBASIC Professional
A111: =A110+1 -> 111 | B111: * DataFlex
A112: =A111+1 -> 112 | B112: * Datalog
A113: =A112+1 -> 113 | B113: * DATATRIEVE
A114: =A113+1 -> 114 | B114: * dc
A115: =A114+1 -> 115 | B115: * DCL
A116: =A115+1 -> 116 | B116: * Deesel (formerly G)
A117: =A116+1 -> 117 | B117: * Dialect
A118: =A117+1 -> 118 | B118: * DinkC
A119: =A118+1 -> 119 | B119: * Dialog Manager
A120: =A119+1 -> 120 | B120: * DIBOL
A121: =A120+1 -> 121 | B121: * DL/I
A122: =A121+1 -> 122 | B122: * Dylan
A123: =A122+1 -> 123 | B123: * Dynace
A124: =A123+1 -> 124 | B124: * E
A125: =A124+1 -> 125 | B125: * Ease
A126: =A125+1 -> 126 | B126: * EASY
A127: =A126+1 -> 127 | B127: * Easy PL/I
A128: =A127+1 -> 128 | B128: * EASYTRIEVE PLUS
A129: =A128+1 -> 129 | B129: * eC (Ecere C)
A130: =A129+1 -> 130 | B130: * ECMAScript
A131: =A130+1 -> 131 | B131: * Ecol
A132: =A131+1 -> 132 | B132: * eDeveloper
A133: =A132+1 -> 133 | B133: * Edinburgh IMP
A134: =A133+1 -> 134 | B134: * EGL
A135: =A134+1 -> 135 | B135: * Eiffel
A136: =A135+1 -> 136 | B136: * Einstein
A137: =A136+1 -> 137 | B137: * Elan
A138: =A137+1 -> 138 | B138: * elastiC
A139: =A138+1 -> 139 | B139: * Elf
A140: =A139+1 -> 140 | B140: * Emacs Lisp
A141: =A140+1 -> 141 | B141: * Englesi
A142: =A141+1 -> 142 | B142: * Epigram
A143: =A142+1 -> 143 | B143: * Erlang
A144: =A143+1 -> 144 | B144: * Escapade
A145: =A144+1 -> 145 | B145: * Escher
A146: =A145+1 -> 146 | B146: * ESPOL
A147: =A146+1 -> 147 | B147: * Esterel
A148: =A147+1 -> 148 | B148: * Etoys
A149: =A148+1 -> 149 | B149: * Euclid
A150: =A149+1 -> 150 | B150: * Euler
A151: =A150+1 -> 151 | B151: * Euphoria
A152: =A151+1 -> 152 | B152: * F
A153: =A152+1 -> 153 | B153: * Factor
A154: =A153+1 -> 154 | B154: * Falcon
A155: =A154+1 -> 155 | B155: * Fan
A156: =A155+1 -> 156 | B156: * Felix
A157: =A156+1 -> 157 | B157: * Ferite
A158: =A157+1 -> 158 | B158: * FFP
A159: =A158+1 -> 159 | B159: * Fjolnir
A160: =A159+1 -> 160 | B160: * FL
A161: =A160+1 -> 161 | B161: * Flavors
A162: =A161+1 -> 162 | B162: * FLOW-MATIC
A163: =A162+1 -> 163 | B163: * Fly
A164: =A163+1 -> 164 | B164: * FOCAL
A165: =A164+1 -> 165 | B165: * FOCUS
A166: =A165+1 -> 166 | B166: * FOIL
A167: =A166+1 -> 167 | B167: * FORMAC
A168: =A167+1 -> 168 | B168: * @Formula
A169: =A168+1 -> 169 | B169: * Forth
A170: =A169+1 -> 170 | B170: * Fortress
A171: =A170+1 -> 171 | B171: * FoxPro 2
A172: =A171+1 -> 172 | B172: * FP
A173: =A172+1 -> 173 | B173: * Franz Lisp
A174: =A173+1 -> 174 | B174: * Frink
A175: =A174+1 -> 175 | B175: * F-Script
A176: =A175+1 -> 176 | B176: * Gambas
A177: =A176+1 -> 177 | B177: * GAMS
A178: =A177+1 -> 178 | B178: * GAP
A179: =A178+1 -> 179 | B179: * G-code
A180: =A179+1 -> 180 | B180: * GDL
A181: =A180+1 -> 181 | B181: * Gibiane
A182: =A181+1 -> 182 | B182: * GJ
A183: =A182+1 -> 183 | B183: * GLSL
A184: =A183+1 -> 184 | B184: * GM
A185: =A184+1 -> 185 | B185: * GML
A186: =A185+1 -> 186 | B186: * GOAL
A187: =A186+1 -> 187 | B187: * Godiva
A188: =A187+1 -> 188 | B188: * Goo
A189: =A188+1 -> 189 | B189: * GOTRAN
A190: =A189+1 -> 190 | B190: * GraphTalk
A191: =A190+1 -> 191 | B191: * GRASS
A192: =A191+1 -> 192 | B192: * HAL/S
A193: =A192+1 -> 193 | B193: * IBM HAScript
A194: =A193+1 -> 194 | B194: * HaXe
A195: =A194+1 -> 195 | B195: * High Level Assembly
A196: =A195+1 -> 196 | B196: * HLSL
A197: =A196+1 -> 197 | B197: * Hop
A198: =A197+1 -> 198 | B198: * Hope
A199: =A198+1 -> 199 | B199: * Hugo
A200: =A199+1 -> 200 | B200: * Hume
A201: =A200+1 -> 201 | B201: * HyperTalk
A202: =A201+1 -> 202 | B202: * IBM Informix-4GL
A203: =A202+1 -> 203 | B203: * IBM RPG
A204: =A203+1 -> 204 | B204: * ICI
A205: =A204+1 -> 205 | B205: * Icon
A206: =A205+1 -> 206 | B206: * Id
A207: =A206+1 -> 207 | B207: * IDL
A208: =A207+1 -> 208 | B208: * IMP
A209: =A208+1 -> 209 | B209: * Inform
A210: =A209+1 -> 210 | B210: * Io
A211: =A210+1 -> 211 | B211: * Ioke
A212: =A211+1 -> 212 | B212: * IPL
A213: =A212+1 -> 213 | B213: * IPTSCRAE
A214: =A213+1 -> 214 | B214: * IronPython
A215: =A214+1 -> 215 | B215: * ISPF
A216: =A215+1 -> 216 | B216: * J
A217: =A216+1 -> 217 | B217: * J++
A218: =A217+1 -> 218 | B218: * JADE
A219: =A218+1 -> 219 | B219: * Jako
A220: =A219+1 -> 220 | B220: * JAL
A221: =A220+1 -> 221 | B221: * Janus
A222: =A221+1 -> 222 | B222: * JASS
A223: =A222+1 -> 223 | B223: * JCL
A224: =A223+1 -> 224 | B224: * JEAN
A225: =A224+1 -> 225 | B225: * JOSS
A226: =A225+1 -> 226 | B226: * Joule
A227: =A226+1 -> 227 | B227: * JOVIAL
A228: =A227+1 -> 228 | B228: * Joy
A229: =A228+1 -> 229 | B229: * JScript
A230: =A229+1 -> 230 | B230: * JSP
A231: =A230+1 -> 231 | B231: * K
A232: =A231+1 -> 232 | B232: * Kaleidoscope
A233: =A232+1 -> 233 | B233: * Kaya
A234: =A233+1 -> 234 | B234: * KEE
A235: =A234+1 -> 235 | B235: * Kiev
A236: =A235+1 -> 236 | B236: * KIF
A237: =A236+1 -> 237 | B237: * Kite
A238: =A237+1 -> 238 | B238: * Kogut
A239: =A238+1 -> 239 | B239: * KRC
A240: =A239+1 -> 240 | B240: * KRYPTON
A241: =A240+1 -> 241 | B241: * ksh
A242: =A241+1 -> 242 | B242: * KUKA
A243: =A242+1 -> 243 | B243: * L
A244: =A243+1 -> 244 | B244: * LabVIEW
A245: =A244+1 -> 245 | B245: * Ladder
A246: =A245+1 -> 246 | B246: * Lagoona
A247: =A246+1 -> 247 | B247: * LANSA
A248: =A247+1 -> 248 | B248: * Lasso
A249: =A248+1 -> 249 | B249: * Lava
A250: =A249+1 -> 250 | B250: * Leadwerks Script
A251: =A250+1 -> 251 | B251: * Leda
A252: =A251+1 -> 252 | B252: * Legoscript
A253: =A252+1 -> 253 | B253: * Limnor
A254: =A253+1 -> 254 | B254: * LINC
A255: =A254+1 -> 255 | B255: * Lingo
A256: =A255+1 -> 256 | B256: * Linoleum
A257: =A256+1 -> 257 | B257: * LIS
A258: =A257+1 -> 258 | B258: * LISA
A259: =A258+1 -> 259 | B259: * Lisaac
A260: =A259+1 -> 260 | B260: * Lisp - ISO/IEC 13816
A261: =A260+1 -> 261 | B261: * Lithe
A262: =A261+1 -> 262 | B262: * Little b
A263: =A262+1 -> 263 | B263: * Logix
A264: =A263+1 -> 264 | B264: * Logo
A265: =A264+1 -> 265 | B265: * LOLCODE
A266: =A265+1 -> 266 | B266: * LPC
A267: =A266+1 -> 267 | B267: * LSE
A268: =A267+1 -> 268 | B268: * LSL
A269: =A268+1 -> 269 | B269: * Lucid
A270: =A269+1 -> 270 | B270: * Lush
A271: =A270+1 -> 271 | B271: * Lustre
A272: =A271+1 -> 272 | B272: * LYaPAS
A273: =A272+1 -> 273 | B273: * Lynx
A274: =A273+1 -> 274 | B274: * M
A275: =A274+1 -> 275 | B275: * MAD
A276: =A275+1 -> 276 | B276: * Magik
A277: =A276+1 -> 277 | B277: * Magma
A278: =A277+1 -> 278 | B278: * MapBasic
A279: =A278+1 -> 279 | B279: * Maple
A280: =A279+1 -> 280 | B280: * Mary
A281: =A280+1 -> 281 | B281: * Maxima (see also Macsyma)
A282: =A281+1 -> 282 | B282: * MaxScript internal language 3D Studio Max
A283: =A282+1 -> 283 | B283: * Maya (MEL)
A284: =A283+1 -> 284 | B284: * MDL
A285: =A284+1 -> 285 | B285: * Mercury
A286: =A285+1 -> 286 | B286: * Mesa
A287: =A286+1 -> 287 | B287: * MetaL
A288: =A287+1 -> 288 | B288: * Microcode
A289: =A288+1 -> 289 | B289: * MicroScript
A290: =A289+1 -> 290 | B290: * MIIS
A291: =A290+1 -> 291 | B291: * MillScript
A292: =A291+1 -> 292 | B292: * MIMIC
A293: =A292+1 -> 293 | B293: * min
A294: =A293+1 -> 294 | B294: * Mindscript
A295: =A294+1 -> 295 | B295: * Miranda
A296: =A295+1 -> 296 | B296: * MIVA Script
A297: =A296+1 -> 297 | B297: * ML
A298: =A297+1 -> 298 | B298: * Moby
A299: =A298+1 -> 299 | B299: * Model 204
A300: =A299+1 -> 300 | B300: * Mohol,
A301: =A300+1 -> 301 | B301: * Mondrian
A302: =A301+1 -> 302 | B302: * MOO
A303: =A302+1 -> 303 | B303: * Mortran
A304: =A303+1 -> 304 | B304: * Moto
A305: =A304+1 -> 305 | B305: * Mouse
A306: =A305+1 -> 306 | B306: * MPD
A307: =A306+1 -> 307 | B307: * MSL
A308: =A307+1 -> 308 | B308: * MSX BASIC
A309: =A308+1 -> 309 | B309: * MUMPS
A310: =A309+1 -> 310 | B310: * Murphy Language
A311: =A310+1 -> 311 | B311: * Napier88
A312: =A311+1 -> 312 | B312: * NATURAL
A313: =A312+1 -> 313 | B313: * NEAT chipset
A314: =A313+1 -> 314 | B314: * Neko
A315: =A314+1 -> 315 | B315: * Nemerle
A316: =A315+1 -> 316 | B316: * NESL
A317: =A316+1 -> 317 | B317: * Net.Data
A318: =A317+1 -> 318 | B318: * NetLogo
A319: =A318+1 -> 319 | B319: * NewLISP
A320: =A319+1 -> 320 | B320: * NEWP
A321: =A320+1 -> 321 | B321: * NewtonScript
A322: =A321+1 -> 322 | B322: * NGL
A323: =A322+1 -> 323 | B323: * Nial
A324: =A323+1 -> 324 | B324: * Nice
A325: =A324+1 -> 325 | B325: * Nickle
A326: =A325+1 -> 326 | B326: * Nosica
A327: =A326+1 -> 327 | B327: * NPL
A328: =A327+1 -> 328 | B328: * NQC
A329: =A328+1 -> 329 | B329: * Nu
A330: =A329+1 -> 330 | B330: * NXC
A331: =A330+1 -> 331 | B331: * NXT-G
A332: =A331+1 -> 332 | B332: * Oak
A333: =A332+1 -> 333 | B333: * Oberon
A334: =A333+1 -> 334 | B334: * Object Lisp
A335: =A334+1 -> 335 | B335: * ObjectLOGO
A336: =A335+1 -> 336 | B336: * Object Pascal
A337: =A336+1 -> 337 | B337: * Objective-C
A338: =A337+1 -> 338 | B338: * Objective Caml
A339: =A338+1 -> 339 | B339: * Objective-J
A340: =A339+1 -> 340 | B340: * Obliq
A341: =A340+1 -> 341 | B341: * Obol
A342: =A341+1 -> 342 | B342: * occam
A343: =A342+1 -> 343 | B343: * Octave
A344: =A343+1 -> 344 | B344: * OmniMark
A345: =A344+1 -> 345 | B345: * Onyx
A346: =A345+1 -> 346 | B346: * Opal
A347: =A346+1 -> 347 | B347: * OpenEdge ABL
A348: =A347+1 -> 348 | B348: * OPL
A349: =A348+1 -> 349 | B349: * OPS5
A350: =A349+1 -> 350 | B350: * Orc
A351: =A350+1 -> 351 | B351: * Orwell
A352: =A351+1 -> 352 | B352: * Oxygene
A353: =A352+1 -> 353 | B353: * Oz
A354: =A353+1 -> 354 | B354: * PARI/GP
A355: =A354+1 -> 355 | B355: * Pawn
A356: =A355+1 -> 356 | B356: * PCASTL
A357: =A356+1 -> 357 | B357: * PCF
A358: =A357+1 -> 358 | B358: * Phrogram
A359: =A358+1 -> 359 | B359: * Pico
A360: =A359+1 -> 360 | B360: * Pict
A361: =A360+1 -> 361 | B361: * Piet
A362: =A361+1 -> 362 | B362: * Pike
A363: =A362+1 -> 363 | B363: * PIKT
A364: =A363+1 -> 364 | B364: * PILOT
A365: =A364+1 -> 365 | B365: * Pizza
A366: =A365+1 -> 366 | B366: * PL-11
A367: =A366+1 -> 367 | B367: * PL/0
A368: =A367+1 -> 368 | B368: * PL/B
A369: =A368+1 -> 369 | B369: * PL/C
A370: =A369+1 -> 370 | B370: * PL/I - ISO 6160
A371: =A370+1 -> 371 | B371: * PL/M
A372: =A371+1 -> 372 | B372: * PL/P
A373: =A372+1 -> 373 | B373: * PL/SQL
A374: =A373+1 -> 374 | B374: * PL360
A375: =A374+1 -> 375 | B375: * PLANC
A376: =A375+1 -> 376 | B376: * Plankalkul
A377: =A376+1 -> 377 | B377: * PLEX
A378: =A377+1 -> 378 | B378: * PLEXIL
A379: =A378+1 -> 379 | B379: * Pliant
A380: =A379+1 -> 380 | B380: * POP-11
A381: =A380+1 -> 381 | B381: * Poplog
A382: =A381+1 -> 382 | B382: * PortablE
A383: =A382+1 -> 383 | B383: * Powerhouse
A384: =A383+1 -> 384 | B384: * PowerScript
A385: =A384+1 -> 385 | B385: * PPL
A386: =A385+1 -> 386 | B386: * Processing
A387: =A386+1 -> 387 | B387: * Prograph
A388: =A387+1 -> 388 | B388: * PROIV
A389: =A388+1 -> 389 | B389: * Promela
A390: =A389+1 -> 390 | B390: * PROTEL
A391: =A390+1 -> 391 | B391: * Proteus
A392: =A391+1 -> 392 | B392: * ProvideX
A393: =A392+1 -> 393 | B393: * Pure
A394: =A393+1 -> 394 | B394: * Q
A395: =A394+1 -> 395 | B395: * Qi
A396: =A395+1 -> 396 | B396: * QtScript
A397: =A396+1 -> 397 | B397: * QBasic
A398: =A397+1 -> 398 | B398: * QuakeC
A399: =A398+1 -> 399 | B399: * QPL
A400: =A399+1 -> 400 | B400: * R
A401: =A400+1 -> 401 | B401: * R++
A402: =A401+1 -> 402 | B402: * Rapira
A403: =A402+1 -> 403 | B403: * Ratfiv
A404: =A403+1 -> 404 | B404: * Ratfor
A405: =A404+1 -> 405 | B405: * RBScript
A406: =A405+1 -> 406 | B406: * rc
A407: =A406+1 -> 407 | B407: * Redcode
A408: =A407+1 -> 408 | B408: * REFAL
A409: =A408+1 -> 409 | B409: * Reia
A410: =A409+1 -> 410 | B410: * Revolution
A411: =A410+1 -> 411 | B411: * rex
A412: =A411+1 -> 412 | B412: * REXX
A413: =A412+1 -> 413 | B413: * Rlab
A414: =A413+1 -> 414 | B414: * ROOP
A415: =A414+1 -> 415 | B415: * RPG
A416: =A415+1 -> 416 | B416: * RPL
A417: =A416+1 -> 417 | B417: * RSL
A418: =A417+1 -> 418 | B418: * Ruby
A419: =A418+1 -> 419 | B419: * RapidBATCH
A420: =A419+1 -> 420 | B420: * S
A421: =A420+1 -> 421 | B421: * S2
A422: =A421+1 -> 422 | B422: * S3
A423: =A422+1 -> 423 | B423: * S-Lang
A424: =A423+1 -> 424 | B424: * S-PLUS
A425: =A424+1 -> 425 | B425: * SA-C
A426: =A425+1 -> 426 | B426: * SAC
A427: =A426+1 -> 427 | B427: * SAIL
A428: =A427+1 -> 428 | B428: * SALSA
A429: =A428+1 -> 429 | B429: * SAM76
A430: =A429+1 -> 430 | B430: * SAS
A431: =A430+1 -> 431 | B431: * SASL
A432: =A431+1 -> 432 | B432: * Sather
A433: =A432+1 -> 433 | B433: * Sawzall
A434: =A433+1 -> 434 | B434: * SBL
A435: =A434+1 -> 435 | B435: * Scala
A436: =A435+1 -> 436 | B436: * Scheme
A437: =A436+1 -> 437 | B437: * Scilab
A438: =A437+1 -> 438 | B438: * Scratch
A439: =A438+1 -> 439 | B439: * Sed
A440: =A439+1 -> 440 | B440: * Seed7
A441: =A440+1 -> 441 | B441: * Self
A442: =A441+1 -> 442 | B442: * SETL
A443: =A442+1 -> 443 | B443: * Shakespeare
A444: =A443+1 -> 444 | B444: * Shift Script
A445: =A444+1 -> 445 | B445: * SiMPLE
A446: =A445+1 -> 446 | B446: * SIMPOL
A447: =A446+1 -> 447 | B447: * SIMSCRIPT
A448: =A447+1 -> 448 | B448: * SISAL
A449: =A448+1 -> 449 | B449: * Slate
A450: =A449+1 -> 450 | B450: * SLIP
A451: =A450+1 -> 451 | B451: * SMALL
A452: =A451+1 -> 452 | B452: * Smalltalk
A453: =A452+1 -> 453 | B453: * SML
A454: =A453+1 -> 454 | B454: * Snow
A455: =A454+1 -> 455 | B455: * Snowball
A456: =A455+1 -> 456 | B456: * SNUSP
A457: =A456+1 -> 457 | B457: * SOL
A458: =A457+1 -> 458 | B458: * Span
A459: =A458+1 -> 459 | B459: * SPARK
A460: =A459+1 -> 460 | B460: * Spice
A461: =A460+1 -> 461 | B461: * SPIN
A462: =A461+1 -> 462 | B462: * SP/k
A463: =A462+1 -> 463 | B463: * SPS
A464: =A463+1 -> 464 | B464: * Squeak
A465: =A464+1 -> 465 | B465: * Squirrel
A466: =A465+1 -> 466 | B466: * SR
A467: =A466+1 -> 467 | B467: * SSL
A468: =A467+1 -> 468 | B468: * Strand
A469: =A468+1 -> 469 | B469: * Subtext
A470: =A469+1 -> 470 | B470: * Suneido
A471: =A470+1 -> 471 | B471: * SuperCollider
A472: =A471+1 -> 472 | B472: * SYMPL
A473: =A472+1 -> 473 | B473: * SyncCharts
A474: =A473+1 -> 474 | B474: * SystemVerilog
A475: =A474+1 -> 475 | B475: * T
A476: =A475+1 -> 476 | B476: * TACL
A477: =A476+1 -> 477 | B477: * TACPOL
A478: =A477+1 -> 478 | B478: * TADS
A479: =A478+1 -> 479 | B479: * TAL
A480: =A479+1 -> 480 | B480: * Tcl
A481: =A480+1 -> 481 | B481: * Tea
A482: =A481+1 -> 482 | B482: * TECO
A483: =A482+1 -> 483 | B483: * TELCOMP
A484: =A483+1 -> 484 | B484: * gt-Telon
A485: =A484+1 -> 485 | B485: * TenCORE
A486: =A485+1 -> 486 | B486: * TeX
A487: =A486+1 -> 487 | B487: * TEX
A488: =A487+1 -> 488 | B488: * TIE
A489: =A488+1 -> 489 | B489: * Timber
A490: =A489+1 -> 490 | B490: * Tom
A491: =A490+1 -> 491 | B491: * TOM
A492: =A491+1 -> 492 | B492: * Topspeed
A493: =A492+1 -> 493 | B493: * TPU
A494: =A493+1 -> 494 | B494: * Trac
A495: =A494+1 -> 495 | B495: * T-SQL
A496: =A495+1 -> 496 | B496: * TTCN
A497: =A496+1 -> 497 | B497: * Turing
A498: =A497+1 -> 498 | B498: * TUTOR
A499: =A498+1 -> 499 | B499: * TXL
A500: =A499+1 -> 500 | B500: * Ubercode
A501: =A500+1 -> 501 | B501: * Unicon
A502: =A501+1 -> 502 | B502: * Uniface
A503: =A502+1 -> 503 | B503: * uniPaaS
A504: =A503+1 -> 504 | B504: * UNITY
A505: =A504+1 -> 505 | B505: * Unix shell
A506: =A505+1 -> 506 | B506: * Unlambda
A507: =A506+1 -> 507 | B507: * UnrealScript
A508: =A507+1 -> 508 | B508: * USE (Regency Systems)
A509: =A508+1 -> 509 | B509: * Vala
A510: =A509+1 -> 510 | B510: * VBA
A511: =A510+1 -> 511 | B511: * VBScript
A512: =A511+1 -> 512 | B512: * Verilog
A513: =A512+1 -> 513 | B513: * VHDL
A514: =A513+1 -> 514 | B514: * Water
A515: =A514+1 -> 515 | B515: * WATFIV, WATFOR
A516: =A515+1 -> 516 | B516: * WebQL
A517: =A516+1 -> 517 | B517: * Whitespace
A518: =A517+1 -> 518 | B518: * Winbatch
A519: =A518+1 -> 519 | B519: * X++
A520: =A519+1 -> 520 | B520: * X10
A521: =A520+1 -> 521 | B521: * XBL
A522: =A521+1 -> 522 | B522: * xHarbour
A523: =A522+1 -> 523 | B523: * XL
A524: =A523+1 -> 524 | B524: * XOTcl
A525: =A524+1 -> 525 | B525: * XPL
A526: =A525+1 -> 526 | B526: * XPL0
A527: =A526+1 -> 527 | B527: * XQuery
A528: =A527+1 -> 528 | B528: * Y
A529: =A528+1 -> 529 | B529: * YACC
A530: =A529+1 -> 530 | B530: * YAL
A531: =A530+1 -> 531 | B531: * Yoix
A532: =A531+1 -> 532 | B532: * Yorick
A533: =A532+1 -> 533 | B533: * Z
A534: =A533+1 -> 534 | B534: * Z notation
A535: =A534+1 -> 535 | B535: * Zeno
A536: =A535+1 -> 536 | B536: * Zonnon
A537: =A536+1 -> 537 | B537: * ZOPL
A538: =A537+1 -> 538 | B538: * ZPL
A539: =A538+1 -> 539 | B539: * ZZT-oop